{
  "schema_version": "pef.experience.v1",
  "run_id": "acs-version-b-framing-001",
  "source_revision": "264117398e7754d7e91076481cd664b5e197c1d4",
  "intent": {
    "creator_purpose": "Present the integrated ACS hotload installation as a comprehensible local working arrangement for agents on an ongoing software project, without confusing the pack's value with a single component's scope.",
    "user_need": "The owner intends ACS B to help an individual builder turn attention back to meaningful project work instead of repeatedly managing agent handoffs, task ownership, reorientation and review overhead; this remains an unvalidated user-need hypothesis.",
    "user_need_status": "owner_hypothesis",
    "evidence_fact_ids": [
      "F1",
      "F2",
      "F6",
      "F7"
    ]
  },
  "audience": {
    "actor": "Individual technical builder maintaining a real project with multiple AI agents across sessions",
    "job": "Make progress on the project while keeping several AI agents aligned on responsibilities, prior decisions and safe handoffs",
    "trigger": "Returning to a long-running repository or adding more agents after earlier sessions",
    "workaround": "Rereading prior conversations, manually restating decisions and rules, assigning and checking ownership, and reconciling output"
  },
  "position": {
    "decision_id": "D4",
    "promise": "Help the individual builder give more attention to actual project work, supported by repository-level working rules for repeated agent handoffs, continuity, issue traceability and review.",
    "claim_ids": [
      "C1",
      "C2",
      "C3",
      "C4"
    ],
    "limitations": [
      "Owner-selected benefit direction (D6): returning attention to actual project work; exact customer-facing copy and positioning D4 remain unapproved",
      "Intended attention benefit, not independently measured time savings or demonstrated customer outcomes",
      "Requires a compatible, configured repository and pinned component prerequisites; no guaranteed one-click installation",
      "ACS owns coordination; PCM, OIO and CGM remain distinct source-owned components of the integrated installation",
      "Not a hosted service, autonomous decision-maker or automatic recovery of every prior chat",
      "The primary market-facing action is undecided until owner QA Q3 resolves actual click behavior; no preview, external navigation or installation is authorized by this draft"
    ]
  },
  "buyer_journey": [
    {
      "scene_id": "SC1",
      "belief_change": "Within the first screen, identify ACS's repo-installed integrated agent working arrangement, its intended individual-builder audience and relevance to reducing repeated handoff management.",
      "message": "ACS installs shared working rules for AI agents into a project repository. Keep attention on the real project instead of repeatedly rebuilding handoffs."
    },
    {
      "scene_id": "SC2",
      "belief_change": "Recognize repeated context, ownership and acceptance work as one pattern worth addressing",
      "message": "Handoffs, task ownership, earlier decisions and reviews should be easier to pick up across sessions."
    },
    {
      "scene_id": "SC3",
      "belief_change": "Understand the underlying repo-level mechanism and versioned component boundaries behind the already-introduced ACS product.",
      "message": "Inside the repository: explicit coordination, durable continuity, issue history and useful content guidance, with separate ownership."
    },
    {
      "scene_id": "SC4",
      "belief_change": "Understand what coordination, continuity, issue provenance and readable content each contribute",
      "message": "Distinct pieces; one explicitly versioned way of working together."
    },
    {
      "scene_id": "SC5",
      "belief_change": "Understand a real setup has prerequisites, verification and incomplete/partial states",
      "message": "Inspect what gets wired, what is required and whether setup is complete."
    },
    {
      "scene_id": "SC6",
      "belief_change": "Know how source-backed mechanisms, missing independent user-outcome evidence, setup prerequisites and true limitations affect evaluation.",
      "message": "Inspect the mechanisms and prerequisites; outcomes and compatibility should not be claimed beyond demonstrated evidence."
    },
    {
      "scene_id": "SC7",
      "belief_change": "Recognize the need for an intentional next step; the primary click result and permissions are intentionally undefined pending owner Q3.",
      "message": "The next step should reflect what the builder actually wants to accomplish. CTA and behavior awaiting owner direction."
    }
  ],
  "ux_tasks": [
    {
      "id": "T1",
      "scenario": "An individual builder reads the proposed page to learn what the integrated ACS hotload pack does and how its different responsibilities relate to the recurring handoff burden.",
      "success": "Without coaching, the reader can summarize both the intended attention-to-work benefit and the separate ACS/PCM/OIO/CGM roles without assuming a hosted service.",
      "states": [
        "content-loaded",
        "narrow-screen-readable",
        "keyboard-readable",
        "limitations-visible"
      ]
    }
  ],
  "service_touchpoints": [],
  "creative": {
    "headline": "Build with agents. Stop managing every handoff.",
    "outline": [
      "First screen: immediately name ACS and the repository-installed product category, the individual builder, the qualitative attention-to-work benefit, and a representative product-context visual",
      "Relatable human situation: repeated agent handoffs and reorientation take attention from the real project",
      "Solution in context: connect that specific friction to repo-level working rules rather than vague productivity claims",
      "Representative scenario: how a project resumes with coordination, continuity, issues and content guidance playing distinct roles",
      "Evidence and evaluation: source-grounded mechanism checks, evidence limitations and useful installation prerequisites",
      "Technical depth on demand: component ownership, setup contracts, dependencies, READY/PARTIAL caveats and source-linked docs",
      "Next action: hold CTA purpose, label, destination and permissions undecided until owner Q3 clarification"
    ],
    "visual_roles": [
      {
        "scene_id": "SC1",
        "purpose": "Introduce the actual repository-installed product alongside a recognizable individual-builder project, with an immediate product-identification cue and human benefit; avoid abstract problem-only art"
      },
      {
        "scene_id": "SC2",
        "purpose": "Few sequential handoff snapshots in one project, without invented customer time savings or false live records"
      },
      {
        "scene_id": "SC3",
        "purpose": "Deepen the real repo-installed mechanism already named in the first screen, using an inspectable product-context diagram rather than belated product reveal"
      },
      {
        "scene_id": "SC4",
        "purpose": "Four source-owned functions clearly labeled without claiming ACS wrote PCM, OIO or CGM"
      },
      {
        "scene_id": "SC5",
        "purpose": "Conceptual setup and verification states, visibly examples rather than fabricated real logs"
      },
      {
        "scene_id": "SC6",
        "purpose": "Attach credible proof and boundaries to concrete statements; let interested developers explore technical sources without putting audits in the hero"
      },
      {
        "scene_id": "SC7",
        "purpose": "Reserve a human-purpose-and-action decision slot; no preview, link button, installer illustration or click flow chosen until Q3"
      }
    ],
    "acceptance_tests": [
      "A first-time reader can identify WHAT ACS is, WHO it is for and WHY it matters from the first screen without first scrolling through a problem essay",
      "First-time intended builder can paraphrase the human coordination burden and what ACS installs without coaching",
      "Hero and page remain understandable without animation, sound or decorative media",
      "Integrated pack scope is accurate: ACS coordination, PCM continuity/governance, OIO issues, CGM content guidance",
      "No claimed measured savings, live customer story, autonomous decision making, universal installation or phantom approval",
      "Every source-backed claim has pinned provenance; historical CGM requirements are not automatically current successor capabilities",
      "No primary CTA, simulated walkthrough, installer action, write operation or navigation behavior may be implemented until owner explicitly clarifies Q3 and service safety is reviewed",
      "Link and interaction states are tested on mobile and desktop; keyboard focus, semantics and reduced motion are reviewed",
      "Real running ABA output preserves approved wording and story; semantic concerns return to PEF rather than being patched by CSS",
      "Version A remains immutable; Version B is generated into an isolated candidate environment only after owner acceptance",
      "The accepted D6 benefit leads consistently through the page without implying observed user time savings or measured product impact"
    ],
    "forbidden_inherited_patterns": [
      "ACS represented as merely a PCM continuation or merely an agent assignment tool",
      "Process/provenance tables or architecture jargon as primary human hero",
      "Invented invoice morning or fabricated customer outcome with fake precision",
      "First-screen giant feature matrix, glowing robot imagery, meaningless cartoon agent parade",
      "Text baked into visuals before the words have been approved",
      "Preview button falsely suggests real installation, live running tasks or existing repo changes",
      "Unverified compatibility or ROI claims",